{
  "schema_version": 1,
  "status": "ok",
  "project": {
    "schema_version": 1,
    "project_id": "coco_fixture01",
    "name": "fixture-project",
    "created_by": "acct_fixture01",
    "owner_id": "acct_fixture01",
    "status": "active",
    "created_at": "2026-08-24T09:00:00Z"
  },
  "membership": {
    "schema_version": 1,
    "project_id": "coco_fixture01",
    "account": {
      "schema_version": 1,
      "account_id": "acct_fixture01",
      "display_name": "Fixture Owner",
      "email": "owner@coconet.test",
      "created_at": "2026-08-24T09:00:00Z"
    },
    "role": "member",
    "status": "active",
    "created_at": "2026-08-24T09:00:00Z",
    "updated_at": "2026-08-24T09:00:00Z"
  },
  "capabilities": {
    "read": true,
    "write": true,
    "manage": false,
    "share": true,
    "resume": true
  }
}
